{
  "schema_version": "1.0",
  "candidate_id": "cand_0123456789abcdef0123456789abcdef",
  "title": "Standalone skill governance in Google Cloud Agent Registry",
  "source_url": "https://docs.cloud.google.com/agent-registry/overview",
  "normalized_url": "https://docs.cloud.google.com/agent-registry/overview",
  "source_identity": "0d746972cbfb5b327cceccd3780a946052a9b89aa1e01cded13d3580da15b81c",
  "development_identifiers": [],
  "state": "DUPLICATE_CHECKED",
  "created_at_utc": "2026-08-02T12:00:00Z"
}
